{"challenge_id":"luremandate-pairwise-challenge-1","challenge_sha256":"8790964818c56571969904ab8e25b4eee89474bfbd30667d1f9bce3050c0f203","engine":{"engine_artifact_sha256":"aaaaaaaaaaaaaaaaaaaaaaaaaaaaaaaaaaaaaaaaaaaaaaaaaaaaaaaaaaaaaaaa","engine_id":"luremandate-reference","engine_version":"1.0.0"},"limitations":["challenge_omits_expected_decisions_and_reasons_but_does_not_prevent_input_inference","cases_measure_only_declared_metadata_and_stateful_order_not_unrepresented_actions","reference_submission_tests_the_reference_semantics_not_an_external_gateway","engine_identity_and_submitted_results_are_claims_unless_authenticated_externally","passing_is_not_complete_mediation_safety_compliance_or_deployment_authorization"],"results":[{"case_id":"case-0001","decision":"allow","reason_code":"authority_satisfied"},{"case_id":"case-0002","decision":"block","reason_code":"tenant_mismatch"},{"case_id":"case-0003","decision":"block","reason_code":"run_binding_mismatch"},{"case_id":"case-0004","decision":"block","reason_code":"tenant_mismatch"},{"case_id":"case-0005","decision":"block","reason_code":"agent_policy_denied"},{"case_id":"case-0006","decision":"block","reason_code":"tenant_mismatch"},{"case_id":"case-0007","decision":"block","reason_code":"run_binding_mismatch"},{"case_id":"case-0008","decision":"block","reason_code":"tenant_mismatch"},{"case_id":"case-0009","decision":"block","reason_code":"approval_denied"},{"case_id":"case-0010","decision":"block","reason_code":"tenant_mismatch"},{"case_id":"case-0011","decision":"block","reason_code":"run_binding_mismatch"},{"case_id":"case-0012","decision":"block","reason_code":"tenant_mismatch"},{"case_id":"case-0013","decision":"block","reason_code":"agent_policy_denied"},{"case_id":"case-0014","decision":"block","reason_code":"tenant_mismatch"},{"case_id":"case-0015","decision":"block","reason_code":"run_binding_mismatch"},{"case_id":"case-0016","decision":"block","reason_code":"tenant_mismatch"}],"schema":"https://github.com/immu4989/lurebench/spec/luremandate-conformance-submission/v1","schema_version":1,"submission_id":"luremandate-pairwise-reference-submission-1","submitted_at":"2026-09-05T15:02:00Z"}
