{"challenge_id":"luremandate-transitions-challenge-1","challenge_sha256":"483e652efc6d66629204aaef970323d88c7125642946a75d1d212a40d7720e8a","engine":{"engine_artifact_sha256":"aaaaaaaaaaaaaaaaaaaaaaaaaaaaaaaaaaaaaaaaaaaaaaaaaaaaaaaaaaaaaaaa","engine_id":"luremandate-reference","engine_version":"1.0.0"},"limitations":["challenge_omits_expected_decisions_and_reasons_but_does_not_prevent_input_inference","cases_measure_only_declared_metadata_and_stateful_order_not_unrepresented_actions","reference_submission_tests_the_reference_semantics_not_an_external_gateway","engine_identity_and_submitted_results_are_claims_unless_authenticated_externally","passing_is_not_complete_mediation_safety_compliance_or_deployment_authorization"],"results":[{"case_id":"case-0001","decision":"allow","reason_code":"authority_satisfied"},{"case_id":"case-0002","decision":"block","reason_code":"cumulative_limit_exceeded"},{"case_id":"case-0003","decision":"allow","reason_code":"authority_satisfied"},{"case_id":"case-0004","decision":"block","reason_code":"cumulative_limit_exceeded"},{"case_id":"case-0005","decision":"block","reason_code":"approval_denied"},{"case_id":"case-0006","decision":"allow","reason_code":"authority_satisfied"},{"case_id":"case-0007","decision":"allow","reason_code":"authority_satisfied"},{"case_id":"case-0008","decision":"block","reason_code":"cumulative_limit_exceeded"},{"case_id":"case-0009","decision":"block","reason_code":"approval_denied"},{"case_id":"case-0010","decision":"block","reason_code":"approval_replay"},{"case_id":"case-0011","decision":"allow","reason_code":"authority_satisfied"},{"case_id":"case-0012","decision":"allow","reason_code":"authority_satisfied"},{"case_id":"case-0013","decision":"allow","reason_code":"authority_satisfied"},{"case_id":"case-0014","decision":"allow","reason_code":"authority_satisfied"},{"case_id":"case-0015","decision":"block","reason_code":"cumulative_limit_exceeded"},{"case_id":"case-0016","decision":"allow","reason_code":"authority_satisfied"},{"case_id":"case-0017","decision":"allow","reason_code":"authority_satisfied"},{"case_id":"case-0018","decision":"allow","reason_code":"authority_satisfied"},{"case_id":"case-0019","decision":"allow","reason_code":"authority_satisfied"},{"case_id":"case-0020","decision":"allow","reason_code":"authority_satisfied"},{"case_id":"case-0021","decision":"block","reason_code":"cumulative_limit_exceeded"},{"case_id":"case-0022","decision":"block","reason_code":"cumulative_limit_exceeded"},{"case_id":"case-0023","decision":"allow","reason_code":"authority_satisfied"},{"case_id":"case-0024","decision":"block","reason_code":"cumulative_limit_exceeded"},{"case_id":"case-0025","decision":"allow","reason_code":"authority_satisfied"},{"case_id":"case-0026","decision":"block","reason_code":"cumulative_limit_exceeded"},{"case_id":"case-0027","decision":"allow","reason_code":"authority_satisfied"},{"case_id":"case-0028","decision":"allow","reason_code":"authority_satisfied"},{"case_id":"case-0029","decision":"allow","reason_code":"authority_satisfied"},{"case_id":"case-0030","decision":"block","reason_code":"cumulative_limit_exceeded"},{"case_id":"case-0031","decision":"allow","reason_code":"authority_satisfied"},{"case_id":"case-0032","decision":"allow","reason_code":"authority_satisfied"},{"case_id":"case-0033","decision":"block","reason_code":"approval_replay"},{"case_id":"case-0034","decision":"allow","reason_code":"authority_satisfied"},{"case_id":"case-0035","decision":"allow","reason_code":"authority_satisfied"},{"case_id":"case-0036","decision":"block","reason_code":"cumulative_limit_exceeded"},{"case_id":"case-0037","decision":"allow","reason_code":"authority_satisfied"},{"case_id":"case-0038","decision":"block","reason_code":"cumulative_limit_exceeded"},{"case_id":"case-0039","decision":"allow","reason_code":"authority_satisfied"},{"case_id":"case-0040","decision":"block","reason_code":"approval_replay"},{"case_id":"case-0041","decision":"allow","reason_code":"authority_satisfied"}],"schema":"https://github.com/immu4989/lurebench/spec/luremandate-conformance-submission/v1","schema_version":1,"submission_id":"luremandate-transitions-reference-1","submitted_at":"2026-09-06T04:01:00Z"}
