{"challenge_id":"luremandate-counterfactual-challenge-1","challenge_sha256":"be83d8ac58345811e942106e4300e576e2105199e5815005f130dec34990c13e","engine":{"engine_artifact_sha256":"aaaaaaaaaaaaaaaaaaaaaaaaaaaaaaaaaaaaaaaaaaaaaaaaaaaaaaaaaaaaaaaa","engine_id":"luremandate-reference","engine_version":"1.0.0"},"limitations":["challenge_omits_expected_decisions_and_reasons_but_does_not_prevent_input_inference","cases_measure_only_declared_metadata_and_stateful_order_not_unrepresented_actions","reference_submission_tests_the_reference_semantics_not_an_external_gateway","engine_identity_and_submitted_results_are_claims_unless_authenticated_externally","passing_is_not_complete_mediation_safety_compliance_or_deployment_authorization"],"results":[{"case_id":"case-0001","decision":"allow","reason_code":"authority_satisfied"},{"case_id":"case-0002","decision":"block","reason_code":"policy_unknown"},{"case_id":"case-0003","decision":"allow","reason_code":"authority_satisfied"},{"case_id":"case-0004","decision":"block","reason_code":"tenant_mismatch"},{"case_id":"case-0005","decision":"allow","reason_code":"authority_satisfied"},{"case_id":"case-0006","decision":"block","reason_code":"run_binding_mismatch"},{"case_id":"case-0007","decision":"allow","reason_code":"authority_satisfied"},{"case_id":"case-0008","decision":"block","reason_code":"agent_identity_mismatch"},{"case_id":"case-0009","decision":"allow","reason_code":"authority_satisfied"},{"case_id":"case-0010","decision":"block","reason_code":"agent_policy_denied"},{"case_id":"case-0011","decision":"allow","reason_code":"authority_satisfied"},{"case_id":"case-0012","decision":"block","reason_code":"requester_unknown"},{"case_id":"case-0013","decision":"allow","reason_code":"authority_satisfied"},{"case_id":"case-0014","decision":"block","reason_code":"impact_limit_exceeded"},{"case_id":"case-0015","decision":"allow","reason_code":"authority_satisfied"},{"case_id":"case-0016","decision":"block","reason_code":"approval_count_insufficient"},{"case_id":"case-0017","decision":"allow","reason_code":"authority_satisfied"},{"case_id":"case-0018","decision":"block","reason_code":"approval_binding_mismatch"},{"case_id":"case-0019","decision":"allow","reason_code":"authority_satisfied"},{"case_id":"case-0020","decision":"block","reason_code":"approval_denied"},{"case_id":"case-0021","decision":"allow","reason_code":"authority_satisfied"},{"case_id":"case-0022","decision":"block","reason_code":"self_approval"},{"case_id":"case-0023","decision":"allow","reason_code":"authority_satisfied"},{"case_id":"case-0024","decision":"block","reason_code":"approver_unknown"},{"case_id":"case-0025","decision":"allow","reason_code":"authority_satisfied"},{"case_id":"case-0026","decision":"block","reason_code":"approver_role_unauthorized"},{"case_id":"case-0027","decision":"allow","reason_code":"authority_satisfied"},{"case_id":"case-0028","decision":"block","reason_code":"approval_predates_intent"},{"case_id":"case-0029","decision":"allow","reason_code":"authority_satisfied"},{"case_id":"case-0030","decision":"block","reason_code":"approval_after_decision"},{"case_id":"case-0031","decision":"allow","reason_code":"authority_satisfied"},{"case_id":"case-0032","decision":"block","reason_code":"approval_expired"},{"case_id":"case-0033","decision":"allow","reason_code":"authority_satisfied"},{"case_id":"case-0034","decision":"block","reason_code":"approval_window_invalid"},{"case_id":"case-0035","decision":"allow","reason_code":"authority_satisfied"},{"case_id":"case-0036","decision":"block","reason_code":"required_role_missing"},{"case_id":"case-0037","decision":"allow","reason_code":"authority_satisfied"},{"case_id":"case-0038","decision":"block","reason_code":"approval_replay"},{"case_id":"case-0039","decision":"allow","reason_code":"authority_satisfied"},{"case_id":"case-0040","decision":"block","reason_code":"cumulative_limit_exceeded"}],"schema":"https://github.com/immu4989/lurebench/spec/luremandate-conformance-submission/v1","schema_version":1,"submission_id":"luremandate-counterfactual-reference-submission-1","submitted_at":"2026-09-05T15:05:00Z"}
